David Toledo

===== DAYTIME =====
1. Identify the parts of the TCP 3-way handshake by listing the frame summaries of the relevant frames.

1 0.000000000 192.168.64.2 132.163.97.1 TCP 74 37218 → 13 [SYN] Seq=0 Win=32120 Len=® MSS=1460 SACK_PERM TSval=783313780 TSecr=0 WS=128
2 0.029730666 132.163.97.1 192.168.64.2 TCP 66 13 → 37218 [SYN, ACK] Seq=® Ack=1 Win=65535 Len=0 MSS=1382 WS=64 SACK_PERM
3 0.029981645 192.168.64.2 132.163.97.1 TCP 54 13 → 37218 [SYN, ACK] Seq=0 Ack=1 Win=65535 Len=0 37218 → 13 [ACK] Seq=1 Ack=1 Win=32128 Len=©|

